高雄市,新興區,中正三路派出所,高雄市新興區中正三路3號,07-2266137， 07-2270189
高雄市,新興區,中山派出所,高雄市新興區中山一路100號,07-2211209
高雄市,新興區,五福二路派出所,高雄市新興區五福二路222號,07-2316481
高雄市,前金區,自強派出所,高雄市前金區自強二路63號,07-2910188
高雄市,前金區,前金分駐所,高雄市前金區中正四路174號,07-2212901
高雄市,前鎮區,一心派出所,高雄市前鎮區一心一路286號,07-7264661
高雄市,前鎮區,瑞隆派出所,高雄市前鎮區班超路49號,07-8221183
高雄市,前鎮區,草衙派出所,高雄市前鎮區鎮中路150號,07-8213705
高雄市,前鎮區,前鎮派出所,高雄市前鎮區前鎮街260號,07-8310309
高雄市,前鎮區,復興派出所,高雄市前鎮區復興三路96號,07-3342434
高雄市,仁武區,仁武派出所,高雄市仁武區中正路 135 號,07-3711432
高雄市,仁武區,澄觀派出所,高雄市仁武區八德西路 189 號,07-3718188
高雄市,大社區,大社分駐所,高雄市大社區金龍路 63 號,07-3511369
高雄市,大樹區,大樹分駐所,高雄市大樹區中興南路 15 號,07-6512439
高雄市,大樹區,九曲派出所,高雄市大樹區久堂路 130 號,07-6512027
高雄市,大樹區,溪埔派出所,高雄市大樹區溪埔路 65 號,07-6561044
高雄市,鳥松區,鳥松分駐所,高雄市鳥松區中正路 96 號,07-7313343
高雄市,鳥松區,大華派出所,高雄市鳥松區澄清路 821 號,07-3701994
高雄市,鳥松區,仁美派出所,高雄市鳥松區仁德路 16 號,07-7314057
高雄市,鹽埕區,鹽埕分局,高雄市鹽埕區建國四路337號,07-5513424
高雄市,鹽埕區,七賢派出所,高雄市鹽埕區建國四路170號,07-5513534
高雄市,鹽埕區,建國四路派出所,高雄市鹽埕區建國四路257號,07-5512832
高雄市,鹽埕區,五福四路派出所,高雄市鹽埕區五福四路107號,07-5512968
高雄市,小港區,小港分局,高雄市小港區小港路20號,07-8019207
高雄市,小港區,小港派出所,高雄市小港區平和南路119號1樓,07-8215913
高雄市,小港區,漢民派出所,高雄市小港區宏平路367號1樓,07-8064590
高雄市,小港區,高松派出所,高雄市小港區高松路25號1樓,07-8010795
高雄市,小港區,桂陽派出所,高雄市小港區桂陽路338號,07-7912688
高雄市,小港區,大林派出所,高雄市小港區鳳林路116號1樓,07-8712237
高雄市,岡山區,岡山分局,高雄市岡山區壽天里壽天路10號,07-6212025
高雄市,岡山區,壽天派出所,高雄市岡山區大仁北路5號,07-6216400
高雄市,岡山區,前峰派出所,高雄市岡山區中華路53號,07-6265134
高雄市,岡山區,嘉興派出所,高雄市岡山區嘉興路251號,07-6216401
高雄市,橋頭區,橋頭分駐所,高雄市橋頭區成功路156號,07-6113555
高雄市,橋頭區,甲圍派出所,高雄市橋頭區甲樹路1170號,07-6110384
高雄市,燕巢區,鳳雄派出所,高雄市燕巢區鳳旗路171號,07-6153054
高雄市,燕巢區,深水派出所,高雄市燕巢區深興路88號,07-6152054
高雄市,燕巢區,燕巢分駐所,高雄市燕巢區中民路585號,07-6161402
高雄市,梓官區,梓官分駐所,高雄市梓官區梓官路267號,07-6171403
高雄市,梓官區,赤崁派出所,高雄市梓官區赤崁西路12號,07-6101404
高雄市,彌陀區,彌陀分駐所,高雄市彌陀區中華路16號,07-6176405
高雄市,彌陀區,舊港派出所,高雄市彌陀區舊港橫路1號,07-6196994
高雄市,永安區,永安分駐所,高雄市永安區永安路22號,07-6912044
高雄市,左營區,博愛四路派出所,高雄市左營區博愛四路437號,07-3487976
高雄市,左營區,左營派出所,高雄市左營區進學路一號,07-5813019
高雄市,左營區,四海派出所,高雄市左營區明德新村35號,07-5811544
高雄市,左營區,舊城派出所,高雄市左營區左營大路101號,07-5853036
高雄市,左營區,啟文派出所,高雄市左營區中華一路2-12號,07-5831597
高雄市,左營區,新莊派出所,高雄市左營區新莊仔路772號,07-5562630
高雄市,楠梓區,加昌派出所,高雄市楠梓區外環西路119號,07-3655961
高雄市,楠梓區,右昌派出所,高雄市楠梓區建昌里右昌街250號,07-3612977
高雄市,楠梓區,楠梓派出所,高雄市楠梓區東寧里旗楠路25號,07-3511145
高雄市,楠梓區,後勁派出所,高雄市楠梓區宏毅里後昌路214號,07-3612554
高雄市,楠梓區,翠屏派出所,高雄市楠梓區翠屏里德祥路147號,07-3649783
高雄市,湖內區,湖內分局,高雄市湖內區中山路一段290號,07-6932155
高雄市,湖內區,湖街派出所,高雄市湖內區大胡里中山路一段 290 之1號,07-6934784
高雄市,湖內區,湖內派出所,高雄市湖內區中賢里中正路二段95 號,07-6993229
高雄市,路竹區,路竹分駐所,高雄市路竹區竹南里國昌路86巷 24號,07-6962615
高雄市,路竹區,竹滬派出所,高雄市路竹區竹滬里華山路31號,07-6981824
高雄市,路竹區,一甲派出所,高雄市路竹區社西里金平路356號,07-6962954
高雄市,路竹區,湖內交通分隊,高雄市路竹區竹南里國昌路86巷24號,07-6976877
高雄市,茄萣區,砂崙派出所,高雄市茄萣區萬福里白砂路239巷2弄9號,07-6900055
高雄市,茄萣區,茄萣派出所,高雄市茄萣區嘉福里茄萣路二段1號,07-6902276
高雄市,阿蓮區,阿蓮分駐所,高雄市阿蓮區南蓮里忠孝路226號,07-6312029
高雄市,田寮區,田寮分駐所,高雄市田寮區南安里崗安路99號,07-6361878
高雄市,田寮區,崇德派出所,高雄市田寮區崇德里崇德路49號,07-6366774
高雄市,田寮區,蛙潭派出所,高雄市田寮區七星里七星路11號,07-6361192
高雄市,田寮區,古亭派出所,高雄市田寮區古亭里古亭路39號,07-6367058
高雄市,鼓山區,鼓山分局,高雄市鼓山區鼓山一路105號,07-5514005
高雄市,鼓山區,內惟派出所,高雄市鼓山區九如四路1139號,07-5826970
高雄市,鼓山區,龍華派出所,高雄市鼓山區中華一路301號,07-5554803
高雄市,鼓山區,鼓山派出所,高雄市鼓山區鼓山二路81號,07-5511164
高雄市,鼓山區,新濱派出所,高雄市鼓山區臨海三路2號,07-5514863
高雄市,旗津區,中洲派出所,高雄市旗津區中洲二路66號,07-5712328
高雄市,旗津區,旗津派出所,高雄市旗津區廟前路137號,07-5715492
高雄市,三民區,三民第一分局,高雄市三民區同盟一路367號,07-3118675
高雄市,三民區,十全派出所,高雄市三民區十全一路86號,07-3115807
高雄市,三民區,哈爾濱派出所,高雄市三民區哈爾濱街215號,07-3110785
高雄市,三民區,長明派出所,高雄市三民區南華路253號,07-2357624
高雄市,三民區,三民派出所,高雄市三民區建國三路188號,07-2211460
高雄市,三民區,鼎山派出所,高雄市三民區鼎山街260號,07-3907880
高雄市,三民區,鼎金派出所,高雄市三民區鼎力路125號,07-3426730
高雄市,三民區,民族派出所,高雄市三民區民族一路208號,07-3822653
高雄市,三民區,陽明派出所,高雄市三民區義華路272號,07-3922032
高雄市,三民區,覺民派出所,高雄市三民區覺民路366號１樓,07-3842108
高雄市,旗山區,建國派出所,高雄市旗山區湄洲里華中街1號,07-6612045
高雄市,旗山區,大洲派出所,高雄市旗山區大山里旗南二路128號,07-6661305
高雄市,旗山區,嶺口派出所,高雄市旗山區南勝里旗南三路212號,07-6651021
高雄市,旗山區,旗尾派出所,高雄市旗山區東平里延平二路21號,07-6614306
高雄市,旗山區,廣福派出所,高雄市旗山區廣福里旗屏二路18號,07-6613260
高雄市,旗山區,圓潭派出所,高雄市旗山區中正里旗甲路三段165號,07-6691307
高雄市,美濃區,美濃分駐所,高雄市美濃區泰安里永安路122號,07-6812029
高雄市,美濃區,中壇派出所,高雄市美濃區祿興里中興路一段636號,07-6812798
高雄市,美濃區,吉東派出所,高雄市美濃區吉和里中正路三段416號,07-6831744
高雄市,美濃區,龍肚派出所,高雄市美濃區龍山里龍肚街63號,07-6851797
高雄市,美濃區,廣興派出所,高雄市美濃區廣德里民族路100號,07-6812794
高雄市,內門區,內門分駐所,高雄市內門區內門里內門114號,07-6671309
高雄市,內門區,中埔派出所,高雄市內門區中埔里中埔36號,07-6673308
高雄市,內門區,溝坪派出所,高雄市內門區永興里頂庄9號,07-6601670
高雄市,杉林區,杉林分駐所,高雄市杉林區上平里山仙路87號,07-6771154
高雄市,杉林區,茄興派出所,高雄市杉林區木梓里茄苳巷144號,07-6779274
高雄市,甲仙區,甲仙分駐所,高雄市甲仙區東安里和安路42號,07-6751204
高雄市,甲仙區,里關派出所,高雄市甲仙區關山里中興路44巷10號,07-6752006
高雄市,苓雅區,苓雅分局,高雄市苓雅區苓雅一路367號,07-3353760
高雄市,苓雅區,成功派出所,高雄市苓雅區成功一路136號,07-3334793
高雄市,苓雅區,民權派出所,高雄市苓雅區四維二路369號,07-3333631
高雄市,苓雅區,凱旋派出所,高雄市苓雅區凱旋二路145號,07-2236222
高雄市,苓雅區,三多派出所,高雄市苓雅區三多一路168號,07-7615655
高雄市,苓雅區,福德派出所,高雄市苓雅區福德二路77號,07-7233343
高雄市,鳳山區,鳳山分局,高雄市鳳山區新興里經武路36號,07-7456110
高雄市,鳳山區,鳳崗派出所,鳳山區縣衙里曹公路 23 號,07-7412244， 07-7476099
高雄市,鳳山區,成功派出所,鳳山區誠正里中山東路 16 號,07-7462453， 07-7102814
高雄市,鳳山區,五甲派出所,鳳山區富甲里五甲二路 472 號,07-7615839， 07-7163696
高雄市,鳳山區,新甲派出所,鳳山區國光里新富路 383 號,07-7636944， 07-7632242
高雄市,鳳山區,埤頂派出所,鳳山區埤頂里中山東路 497 號,07-7013272， 07-7039438
高雄市,鳳山區,文山派出所,鳳山區文山里鳳松路 127 號,07-7324340， 07-7324341
高雄市,鳳山區,過埤派出所,鳳山區過埤里保生路 69 號,07-7923028， 07-7928168
高雄市,茂林區,茂林分駐所,茂林區茂林里茂林巷13號,07-6801200
高雄市,茂林區,萬山派出所,茂林區萬山里萬山巷1號,07-6891203
高雄市,鳳山區,忠孝派出所,鳳山區忠孝里光復路二段 188 號,07-7430754， 07-7402658
高雄市,茂林區,多納派出所,茂林區多納里多納巷1號,07-6801208
高雄市,茂林區,森山派出所,茂林區茂林里扇平巷121號,07-6892394
高雄市,六龜區,寶來派出所,六龜區寶來里中正路21號,07-6881170
高雄市,六龜區,荖濃派出所,六龜區荖濃里裕濃路18號,07-6881014
高雄市,六龜區,新威派出所,六龜區新威里新威路127號,07-6871176
高雄市,六龜區,義寶派出所,高雄市六龜區民生路1號,07-6891049
高雄市,桃源區,建山派出所,桃源區建山里建山巷36號,07-6881442
高雄市,桃源區,森濤派出所,桃源區寶山里寶山巷145號,07-6892474
高雄市,桃源區,寶山派出所,桃源區寶山里寶山巷16號,07-6892464
高雄市,桃源區,桃源分駐所,桃源區桃源里南進巷183號,07-6871176
高雄市,桃源區,高中派出所,桃源區高中里興中巷90號,07-6881385
高雄市,桃源區,復興派出所,桃源區復興里復興巷1號,07-6866088
高雄市,桃源區,拉芙蘭派出所,桃源區梅蘭里梅蘭巷113 號,07-6866087
高雄市,桃源區,梅山派出所,桃源區梅山里梅山巷52號,07-6866170
高雄市,那瑪夏區,那瑪夏分駐所,那瑪夏區民族里鞍山巷61號,07-6701168
高雄市,那瑪夏區,民權派出所,那瑪夏區民族里平和巷11號,07-6701282
高雄市,那瑪夏區,達卡努瓦派出所,那瑪夏區民生里秀領巷87號,07-6701118
高雄市,那瑪夏區,民治派出所,那瑪夏區民族里錫安山巷1號,07-6761280
高雄市,林園區,林園派出所,高雄市林園區林園北路201號,07-6412013
高雄市,林園區,港埔派出所,高雄市林園區沿海路四段326號,07-6413695
高雄市,林園區,中芸派出所,高雄市林園區力行路250號,07-6412792
高雄市,林園區,林園分隊港埔小隊,高雄市林園區沿海路四段326號,07-6413695
高雄市,大寮區,昭明派出所,高雄市大寮區鳳林一路287號,07-6411903
高雄市,大寮區,大寮分駐所,高雄市大寮區鳳林三路377號,07-7816336
高雄市,大寮區,忠義派出所,高雄市大寮區鳳林四路353 號,07-7817429
高雄市,大寮區,中庄派出所,高雄市大寮區仁愛路101號,07-7016714
高雄市,大寮區,大發駐在所,高雄市大寮區華中路1號,07-7884000
高雄市,大寮區,交通大隊林園分隊,高雄市大寮區鳳林四路353 號,07-7826500
屏東縣,屏東市,民和派出所,屏東市民生路40號,08-7223077
屏東縣,屏東市,民生派出所,屏東市北平路40號,08-7322646
屏東縣,屏東市,民族派出所,屏東市民族路152號,08-7322072
屏東縣,屏東市,大同派出所,屏東市清進巷208號,08-7555413
屏東縣,屏東市,崇蘭派出所,屏東市迪化街48號,08-7656206
屏東縣,屏東市,建國派出所,屏東市復興路243號,08-7522978
屏東縣,屏東市,歸來派出所,屏東市民生東路94號,08-7224416
屏東縣,屏東市,海豐派出所,屏東市海豐街18號,08-7367704
屏東縣,屏東市,公館派出所,屏東市龍華路157號,08-7527484
屏東縣,萬丹鄉,新鐘派出所,屏東縣萬丹鄉新鐘村新鐘路64號,08-7772254
屏東縣,萬丹鄉,萬丹分駐所,屏東縣萬丹鄉萬丹路136號,08-7772004
屏東縣,長治鄉,德協派出所,屏東縣長治鄉德協村中興路635號,08-7621604
屏東縣,長治鄉,繁華派出所,屏東縣長治鄉繁昌村中山路102號,08-7621384
屏東縣,長治鄉,長治分駐所,屏東縣長治鄉進興村復興路2號,08-7366741
屏東縣,麟洛鄉,麟洛分駐所,屏東縣麟洛鄉中山路437號,08-7221528
屏東縣,內埔鄉,內埔派出所,屏東縣內埔鄉內埔村中興路158號1樓,08-7792018
屏東縣,內埔鄉,龍泉派出所,屏東縣內埔鄉龍泉村原勝路76號,08-7701744
屏東縣,內埔鄉,新北勢派出所,屏東縣內埔鄉豐田村新中路137號,08-7792804
屏東縣,萬巒鄉,萬巒分駐所,屏東縣萬巒鄉萬巒村褒忠路167號,08-7811320
屏東縣,萬巒鄉,佳佐派出所,屏東縣萬巒鄉佳和村佳興路30號,08-7831114
屏東縣,萬巒鄉,赤山派出所,屏東縣萬巒鄉赤山村東山路101號,08-7833451
屏東縣,瑪家鄉,瑪家分駐所,屏東縣瑪家鄉北葉村風景巷1號,08-7991749
屏東縣,瑪家鄉,佳義派出所,屏東縣瑪家鄉佳義村泰平巷83之一號,08-7990163
屏東縣,泰武鄉,泰武分駐所,屏東縣泰武鄉佳平村佳平巷1號,08-7833038
屏東縣,泰武鄉,忠孝派出所,屏東縣泰武鄉泰武村良武巷101號,08-7920001
屏東縣,高樹鄉,泰山派出所,屏東縣高樹鄉山下路71號,08-7956334
屏東縣,高樹鄉,新南派出所,屏東縣高樹鄉興店路8號,08-7962584
屏東縣,高樹鄉,高樹警察分駐所,屏東縣高樹鄉興中路334號,08-7962021
屏東縣,高樹鄉,舊寮派出所,屏東縣高樹鄉新豐村民安路1號之10,08-7916063
屏東縣,九如鄉,九如分駐所,屏東縣九如鄉九如路二段177號,08-7392424
屏東縣,鹽埔鄉,鹽埔分駐所,屏東縣鹽埔鄉中山路41號,08-7932224
屏東縣,鹽埔鄉,新圍派出所,屏東縣鹽埔鄉維新路129號,08-7932244
屏東縣,鹽埔鄉,振興派出所,屏東縣鹽埔鄉中正路6號,08-7020234
屏東縣,三地門鄉,青山派出所,屏東縣三地門鄉青山村民族巷61號之2,08-7960690
屏東縣,三地門鄉,三地門分駐所,屏東縣三地門鄉治安巷3號,08-7991154
屏東縣,三地門鄉,三德檢查哨,屏東縣三地門鄉達發達旺巷1號,08-7992513
屏東縣,三地門鄉,口社派出所,屏東縣三地門鄉口社村信義巷59號之2,08-7957078
屏東縣,三地門鄉,德文派出所,屏東縣三地門鄉德文巷3號,08-7996067
屏東縣,里港鄉,大平派出所,屏東縣里港鄉中山路103號,08-7752034
屏東縣,里港鄉,三和派出所,屏東縣里港鄉土庫路140號,08-7731145
屏東縣,霧台鄉,霧台分駐所,屏東縣霧台鄉神山巷71號,08-7902238
屏東縣,潮州鎮,光華派出所,屏東縣潮州鎮光華里中山路12號,08-7884265
屏東縣,潮州鎮,中山路派出所,屏東縣潮州鎮新生里新生路81號,08-7882347
屏東縣,潮州鎮,四林派出所,屏東縣潮州鎮泗林里明倫路15號,08-7882767
屏東縣,竹田鄉,竹田分駐所,屏東縣竹田鄉竹田村中正路111號,08-7710734
屏東縣,竹田鄉,泗洲派出所,屏東縣竹田鄉泗洲村洲中路44號,08-7892582
屏東縣,竹田鄉,西勢派出所,屏東縣竹田鄉西勢村龍門路58號,08-7792844
屏東縣,新埤鄉,新埤分駐所,屏東縣新埤鄉新埤村新華路146號,08-7971045
屏東縣,新埤鄉,餉潭派出所,屏東縣新埤鄉餉潭村龍潭路137號,08-7981819
屏東縣,來義鄉,來義分駐所,屏東縣來義鄉古樓村中正路92號,08-7850156
屏東縣,來義鄉,南和派出所,屏東縣來義鄉南和村288號,08-8791415
屏東縣,東港鎮,東濱派出所,屏東縣東港鎮延平路112號,08-8322603
屏東縣,東港鎮,東港派出所,屏東縣東港鎮沿海路1號,08-8338183
屏東縣,東港鎮,大鵬灣派出所,屏東縣東港鎮大潭里大潭路122號,08-8338262
屏東縣,林邊鄉,林邊分駐所,屏東縣林邊鄉光林村中山路185號,08-8752018
屏東縣,南州鄉,南州分駐所,屏東縣南州鄉溪州村三民路52號,08-8642047
屏東縣,崁頂鄉,崁頂分駐所,屏東縣崁頂鄉崁頂村中正路117號,08-8631404
屏東縣,新園鄉,新園分駐所,屏東縣新園鄉仙吉村仙吉路140號,08-8681004
屏東縣,新園鄉,興龍派出所,屏東縣新園鄉興龍村南興路278號,08-8322433
屏東縣,琉球鄉,琉球分駐所,屏東縣琉球鄉中福村中山路262號,08-8612231
屏東縣,枋寮鄉,枋寮派出所,屏東縣枋寮鄉(村)中興路33號,08-8782949
屏東縣,枋寮鄉,建興派出所,屏東縣枋寮鄉地利村建興路262號,08-8712962
屏東縣,枋寮鄉,東海派出所,屏東縣枋寮鄉東海村東林路717號,08-8712920
屏東縣,佳冬鄉,佳冬分駐所,屏東縣佳冬鄉六根村佳和路89號,08-8662089
屏東縣,佳冬鄉,石光派出所,屏東縣佳冬鄉石光村中山路200號,08-8662034
屏東縣,枋山鄉,枋山分駐所,屏東縣枋山鄉(村)國中路26巷5-1號,08-8761129
屏東縣,枋山鄉,加祿派出所,屏東縣枋山鄉加祿村(路)102號,08-8720002
屏東縣,枋山鄉,楓港派出所,屏東縣枋山鄉善餘村德隆路19號,08-8771214
屏東縣,春日鄉,春日分駐所,屏東縣春日鄉(村、路)316號,08-8785180
屏東縣,春日鄉,歸崇派出所,屏東縣春日鄉歸崇村玉光路6號,08-8791104
屏東縣,獅子鄉,獅子分駐所,屏東縣獅子鄉楓林村2巷25號,08-8771391
屏東縣,獅子鄉,內獅派出所,屏東縣獅子鄉內獅村(巷)60號,08-8720004
屏東縣,獅子鄉,草埔派出所,屏東縣獅子鄉草埔村5號,08-8701484
屏東縣,恆春鎮,建民派出所,屏東縣恆春鎮城南里中正路60號,08-8892587
屏東縣,恆春鎮,仁壽(頭溝)派出所,屏東縣恆春鎮仁壽里仁壽路117號,08-8893247
屏東縣,恆春鎮,龍水(大光)派出所,屏東縣恆春鎮龍水里龍泉路260號,08-8894172
屏東縣,恆春鎮,墾丁(鵝鑾、南灣)派出所,屏東縣恆春鎮墾丁里墾丁路113號,08-8861039
屏東縣,車城鄉,車城(保力、溫泉)分駐所,屏東縣車城鄉褔興村中山路17號,08-8821152
屏東縣,滿州鄉,滿州(永港)分駐所,屏東縣滿州鄉滿州村中山路60號,08-8801161
屏東縣,滿州鄉,長樂(牡林)派出所,屏東縣滿州鄉長樂村大公路33號,08-8811141
屏東縣,滿州鄉,九棚(高士)派出所,屏東縣滿州鄉港仔村港仔路60號,08-8810200
屏東縣,牡丹鄉,牡丹分駐所,屏東縣牡丹鄉石門村石門路32號,08-8831110
屏東縣,牡丹鄉,旭海(仁愛)派出所,屏東縣牡丹鄉旭海村旭海路1號,08-8830200
屏東縣,屏東市,鄭媽媽手工牛軋糖,屏東縣屏東市公裕街268號,08-7348333
屏東縣,長治鄉,全家長治交流店,屏東縣長治鄉水源路195號,08-7626098
屏東縣,內埔鄉,7-11水門門市,屏東縣內埔鄉水門村忠孝路289號,08-7995113
屏東縣,萬巒鄉,鶉園休閒農場,屏東縣萬巒鄉營區路1巷8號,08-7834236
屏東縣,三地門鄉,7-11頭目門市,屏東縣三地門鄉三地門村中正路2段3號,08-7993903
屏東縣,三地門鄉,山中天休閒餐廳,屏東縣三地門鄉三地村中正路一段10-1號,08-7993440
屏東縣,里港鄉,薰之園香草休閒農場,屏東縣里港鄉過江路126號,08-7722077
屏東縣,霧台鄉,霧台神山愛玉,屏東縣霧臺鄉霧臺村神山巷16-1號,0910-841360
屏東縣,霧台鄉,台灣魯凱族產業發展協會,屏東縣霧台鄉好茶村古茶柏安街17巷5號,08-7997198
屏東縣,竹田鄉,六堆釀興業有限公司(豆油伯),屏東縣竹田鄉履豐村豐振路2-8號,0800-256866
屏東縣,東港鎮,鵬福觀光遊艇,屏東縣東港鎮鵬灣大道五段50號,0963-515930
屏東縣,東港鎮,味益食品行,屏東縣東港鎮新生三路129號,08-8335930
屏東縣,琉球鄉,蜜仔番薯糖,屏東縣琉球鄉中福村白沙觀光港10號商店,08-8612415
屏東縣,恆春鎮,7-11墾丁門市,屏東縣恆春鎮墾丁里墾丁路60號1樓,08-8862303
屏東縣,車城鄉,7-11車城門市,屏東縣車城鄉福安村中山路76號,08-8824246
屏東縣,萬丹鄉,社皮派出所,屏東縣萬丹鄉社口村社皮路二段399號,08-7073044
台東縣,關山鎮,7-11關山門市,臺東縣關山鎮和平路4號4之1號1樓,089-812792
台東縣,東河鄉,都蘭好的擺手創藝術小店,臺東縣東河鄉都蘭村61-2號,089-531702
台東縣,東河鄉,找得到民宿,臺東縣東河鄉東河村南東河421號,089-896638
台東縣,東河鄉,水往上流部落市集,臺東縣東河鄉台11線約148公里處,0980-154799
台東縣,成功鎮,7-11欣功門市,臺東縣成功鎮三民里大同路70號,089-854201
台東縣,關山鎮,關山親水公園,臺東縣關山鎮隆盛路1號,089-815035
台東縣,長濱鄉,長濱驛站,臺東縣長濱鄉長濱里長濱村13鄰299-1號,089-832589
台東縣,長濱鄉,7-11長濱門市,臺東縣長濱鄉2之5號,089-832918
台東縣,太麻里,7-11金崙門市,臺東縣太麻里鄉金崙路262-1號,089-771739
台東縣,大武鄉,全家臺東大竹店,臺東縣大武鄉大竹村大竹6號,089-760208
台東縣,池上鄉,全家池上車站店,臺東縣池上鄉忠孝路269號,089-719130
台東縣,池上鄉,台糖池上牧野渡假村,臺東縣池上鄉新興路110號,089-862736
台東縣,鹿野鄉,阿度的店,臺東縣鹿野鄉龍田村光榮路232號,089-550706
台東縣,鹿野鄉,7-11鹿野門市,臺東縣鹿野鄉中華路一段430號,089-550209
台東縣,臺東市,悠瑞客禮品工坊,臺東市大同路193號,089-332662
台東縣,臺東市,7-11知本睿豐門市,臺東市知本路三段7號,089-510783
台東縣,臺東市,伽藍安檢所,臺東市富岡街299號,089-280468
台東縣,東河鄉,都蘭派出所,臺東縣東河鄉都蘭村都蘭248號,089-531209
台東縣,成功鎮,都歷派出所,臺東縣成功鎮信義里都歷路46號,089-841290
台東縣,長濱鄉,寧埔派出所,臺東縣長濱鄉寧埔村寧埔08號,089-801257
台東縣,長濱鄉,樟原派出所,臺東縣長濱鄉樟原村1鄰10號,089-881027
台東縣,太麻里,美和派出所,臺東縣太麻里鄉美和村6鄰84-1號,089-512542
台東縣,太麻里,太麻里分駐所,臺東縣太麻里鄉泰和村太麻里街142號,089-781134
台東縣,太麻里,金崙派出所,臺東縣太麻里鄉金崙村439號,089-771086
台東縣,太麻里,多良派出所,臺東縣太麻里鄉多良村大溪262號,089-761368
台東縣,大武鄉,大武派出所,臺東縣大武鄉大武村大武街五十二號,089-791125
台東縣,大武鄉,尚武派出所,臺東縣大武鄉尚武村客庄路9號,089-791105
台東縣,達仁鄉,達仁派出所,臺東縣達仁鄉復興村100號,089-702247
台東縣,達仁鄉,森永派出所,臺東縣達仁鄉森永村6號,089-702297
台東縣,臺東市,溫泉派出所,臺東市青海路4段343號,089-512379
台東縣,池上鄉,池上檢查哨,臺東縣池上鄉福原村10鄰中山路211號,089-862004
台東縣,鹿野鄉,瑞豐派出所,臺東縣鹿野鄉瑞豐村10鄰中山路171號,089-811419
台東縣,鹿野鄉,鹿野分駐所,臺東縣鹿野鄉鹿野村9鄰中華路2段57號,089-551114
台東縣,卑南鄉,卑南分駐所,臺東縣卑南鄉賓朗村賓朗路440號,089-223820
花蓮縣,玉里鎮,春日派出所,花蓮縣玉里鎮春日里神農74號,03-8871134
花蓮縣,玉里鎮,觀音派出所,花蓮縣玉里鎮觀音里觀音14號,03-8851040
花蓮縣,花蓮市,TTA汽車公司,花蓮縣花蓮市富吉路1-8號,03-8465535
花蓮縣,花蓮市,洄瀾薯道,花蓮縣花蓮市中正路468號,03-8360777
花蓮縣,花蓮市,東大門國際觀光夜市福町管理委員會,花蓮縣花蓮市重慶路572號,937168555
花蓮縣,花蓮市,花蓮文化創意產業園區,花蓮縣花蓮市中華路144號,03-8313777
花蓮縣,鳳林鎮,讚炭工坊,花蓮縣鳳林鎮鳳義里正義街15號,03-8763488
花蓮縣,光復鄉,台糖花蓮觀光糖廠,花蓮縣光復鄉大進村糖廠街7巷2號,03-8704125
花蓮縣,瑞穗鄉,舞鶴茶園‧公主咖啡,花蓮縣瑞穗鄉舞鶴村中正南路二段336號,03-8870222
花蓮縣,豐濱鄉,北回歸線生活市集,花蓮縣豐濱鄉臺11線70.5公里處,0922-493078
花蓮縣,豐濱鄉,芭崎賣店,花蓮縣豐濱鄉芭崎48號,0916-005943
花蓮縣,富里鄉,富里鄉農會,花蓮縣富里鄉羅山村東湖9鄰6號,03-8821705
花蓮縣,新城鄉,日光微笑七星潭遊客中心,花蓮縣新城鄉大漢村七星街32號,03-8246546
花蓮縣,玉里鎮,甲思町華夫輕食,花蓮縣玉里鎮光復路196號,03-8886586
花蓮縣,玉里鎮,橋頭冰店,花蓮縣玉里鎮中華路79號,03-8886795
花蓮縣,吉安鄉,仁里派出所,花蓮縣吉安鄉仁里村中正路一段38號,03-8527894
