台北市,萬華區,華江派出所,臺北市環河南路二段196號,02-23061531
台北市,萬華區,莒光派出所,臺北市莒光路171號,02-23064987
台北市,萬華區,武昌街派出所,臺北市西寧南路4號,02-23312212
台北市,萬華區,青年路派出所,臺北市萬大路423巷114號,02-23054219
台北市,中山區,中山一派出所,臺北市中山區中山北路1段110號,02-25111499
台北市,中山區,中山二派出所,臺北市中山區中山北路2段90號,02-25412002
台北市,中山區,圓山派出所,臺北市中山區中山北路3段62號,02-25942750
台北市,中山區,長春路派出所,臺北市中山區長春路206號,02-25010644
台北市,中山區,長安東路派出所,臺北市中山區長安東路2段165號,02-27711932
台北市,中山區,民權一派出所,臺北市中山區新生北路二段127-1號,02-25314671
台北市,中山區,建國派出所,臺北市中山區行孝里民族東路284號,02-25091990
台北市,中山區,大直派出所,臺北市中山區北安路456號,02-25332984
台北市,大安區,和平東路派出所,臺北市大安區和平東路1段143號,02-23218073
台北市,大安區,安和路派出所,臺北市大安區信義路4段216號,02-27025232
台北市,大安區,敦化南路派出所,臺北市大安區敦化南路1段236巷26號,02-27710400
台北市,大安區,新生南路派出所,臺北市大安區仁愛路3段18號,02-23258611
台北市,大安區,瑞安街派出所,臺北市大安區瑞安街23巷17號,02-27054164
台北市,大安區,羅斯福路派出所,臺北市大安區羅斯福路4段113巷13號,02-27355761
台北市,大安區,臥龍街派出所,臺北市大安區臥龍街185號,02-27334439
台北市,中正區,仁愛路派出所,臺北市中正區仁愛路1段19號,02-23212067
台北市,中正區,介壽路派出所,臺北市中正區公園路54號,02-23113081
台北市,中正區,博愛路派出所,臺北市中正區博愛路119號,02-23118175
台北市,中正區,忠孝東路派出所,臺北市中正區忠孝東路2段10號,02-23218656
台北市,中正區,忠孝西路派出所,臺北市中正區公園路15號,02-23142722
台北市,中正區,廈門街派出所,臺北市廈門街43號,02-23684427
台北市,中正區,思源街派出所,臺北市汀州路三段72號,02-23650844
台北市,中正區,泉州街派出所,臺北市中華路二段503號,02-23039915
台北市,中正區,南昌路派出所,臺北市南昌路一段7號,02-23218148
台北市,中正區,南海路派出所,臺北市南海路35號,02-23752835
台北市,松山區,三民派出所,臺北市松山區民生東路5段163之1號,02-27621708
台北市,松山區,中崙派出所,臺北市松山區長安東路2段229-1號,02-27711239
台北市,松山區,東社派出所,臺北市松山區敦化北路199巷5之1號,02-27135253
台北市,松山區,松山派出所,臺北市松山區八德路4段692號,02-27670446
台北市,松山區,民有派出所,臺北市松山區民權東路3段162號,02-27123638
台北市,信義區,三張犁派出所,臺北市信義區信義路五段17號,02-27295561
台北市,信義區,五分埔派出所,臺北市信義區永吉路333號,02-27653349
台北市,信義區,六張犁派出所,臺北市信義區嘉興街301號,02-27355068
台北市,信義區,吳興街派出所,臺北市信義區吳興街262號,02-27398997
台北市,信義區,福德街派出所,臺北市信義區福德街198號,02-27273424
台北市,士林區,天母派出所,臺北市士林區中山北路7段192號,02-28714110
台北市,士林區,山仔后派出所,臺北市士林區格致路39號,02-28611295
台北市,士林區,後港派出所,臺北市士林區福港街151號,02-28829373
台北市,士林區,文林派出所,臺北市士林區大東路80號,02-28812211
台北市,士林區,永福派出所,臺北市士林區仰德大道3段49號,02-28616353
台北市,士林區,溪山派出所,臺北市士林區至善路3段263號,02-28411110
台北市,士林區,社子派出所,臺北市士林區延平北路6段192號,02-28122720
台北市,士林區,翠山派出所,臺北市士林區中社路1段56號,02-28411423
台北市,士林區,芝山岩派出所,臺北市士林區仰德大道1段16號,02-28813194
台北市,士林區,蘭雅派出所,臺北市士林區中山北路6段153號1樓,02-28315001
台北市,北投區,光明派出所,臺北市北投區泉源路14號,02-28912047
台北市,北投區,公園派出所,臺北市北投區紗帽路110號,02-28610145
台北市,北投區,大屯派出所,臺北市北投區中和街534號,02-28913971
台北市,北投區,奇岩派出所,臺北市北投區公館路209巷11號,02-28913531
台北市,北投區,永明派出所,臺北市北投區石牌路2段101號,02-28213110
台北市,北投區,石牌派出所,臺北市北投區文林北路296號,02-28231513
台北市,北投區,竹子湖派出所,臺北市北投區竹子湖路16號,02-28231513
台北市,北投區,長安派出所,臺北市北投區中央北路1段1號,02-28911646
台北市,北投區,關渡派出所,臺北市北投區大度路3段305號,02-28583864
台北市,文山區,木柵派出所,臺北市文山區木柵路二段202號,02-29397141
台北市,文山區,木新派出所,臺北市文山區恆光街45號,02-29372488
台北市,文山區,復興派出所,臺北市文山區木柵路一段54號,02-22367140
台北市,文山區,指南派出所,臺北市文山區指南路二段177號,02-29382712
台北市,文山區,萬芳派出所,臺北市文山區萬美街一段50號,02-22391753
台北市,文山區,景美派出所,臺北市景中街2號,02-29313459
台北市,文山區,興隆派出所,臺北市興隆路二段156號,02-29313842
台北市,文山區,萬盛派出所,臺北市羅斯福路五段151號,02-29312502
台北市,南港區,同德派出所,臺北市南港區同德路83號,02-27851062
台北市,南港區,南港派出所,臺北市南港區興中路12巷2號,02-27830476
台北市,南港區,舊莊派出所,臺北市南港區舊莊街1段213號,02-27822492
台北市,南港區,玉成派出所,臺北市南港區向陽路150號1樓,02-27886958
台北市,內湖區,內湖派出所,臺北市內湖路二段261號,02-27900571
台北市,內湖區,潭美派出所,臺北市新明路324號,02-27917233
台北市,內湖區,西湖派出所,臺北市瑞光路515號,02-27987505
台北市,內湖區,大湖派出所,臺北市成功路五段1號,02-27909521
台北市,內湖區,文德派出所,臺北市民權東路六段26號,02-27944946
台北市,內湖區,東湖派出所,臺北市五分街10號,02-26313350
台北市,內湖區,康樂派出所,臺北市康樂街110巷16弄20號,02-26342237
台北市,內湖區,康寧派出所,臺北市金湖路83號,02-87920061
台北市,內湖區,港墘派出所,臺北市內湖路一段550號,02-87518690
桃園市,桃園區,明義堂香行,桃園市桃園區中正路452號,03-3341171
桃園市,大溪區,達文西瓜,桃園市大溪區和平路29號,03-3873089
桃園市,大溪區,桃園市大溪文化協會,桃園市大溪區福仁里草店尾一橫巷3號,03-3880938
桃園市,復興區,和風山莊,桃園市復興區上巴陵中心路160號,03-3912738
桃園市,蘆竹區,桂林商務旅館,桃園市蘆竹區桃園街106號,03-3116799
桃園市,蘆竹區,麗嬰房觀光工廠,桃園市蘆竹區海湖里海山中街8號,03-3544417
桃園市,蘆竹區,尊爵天際大飯店,桃園市蘆竹區南崁路一段108號,03-2121001
桃園市,桃園區,武陵派出所,桃園區復興路135號,03-3364224
桃園市,桃園區,青溪派出所,桃園區鎮輔街39號,03-3332742
桃園市,桃園區,埔子派出所,桃園區文中北路2號,03-3353974
桃園市,桃園區,龍安派出所,桃園區國豐一街101號,03-3601975
桃園市,中壢區,大崙派出所,中壢區中正路四段186號,03-4982260
桃園市,中壢區,中福派出所,中壢區南園二路86號,03-4523093
桃園市,中壢區,內壢派出所,中壢區中華路一段364號,03-4557521
桃園市,中壢區,普仁派出所,中壢區日新路20號,03-4562912
桃園市,中壢區,龍興派出所,中壢區龍勇路141號,03-4285776
桃園市,中壢區,青埔派出所,中壢區青埔路一段67號,03-4531356
桃園市,楊梅區,楊梅派出所,楊梅區中山路123號,03-4782007
桃園市,楊梅區,草湳派出所,楊梅區永美路237號,03-4826278
桃園市,楊梅區,富岡派出所,楊梅區富源街22號,03-4721794
桃園市,新屋區,永安派出所,新屋區永安村中山西路三段62號,03-4861092
桃園市,新屋區,大坡派出所,新屋區大坡村5鄰94號,03-4768410
桃園市,大園區,埔心派出所,大園區埔心村14鄰1號,03-3811684
桃園市,大園區,潮音派出所,大園區北港村12鄰9號,03-3862314
桃園市,觀音區,草漯派出所,觀音區草漯村7鄰大觀路2段77號,03-4831224
桃園市,觀音區,新坡派出所,觀音區大同村5鄰中山路2段668號,03-4981001
桃園市,平鎮區,宋屋派出所,平鎮區延平路二段412號,03-4938381
桃園市,平鎮區,北勢派出所,平鎮區振平街228號,03-4282206
桃園市,平鎮區,建安派出所,平鎮區金陵路5段108號,03-4502331
桃園市,平鎮區,龍岡派出所,平鎮區龍南路141號,03-4503245
桃園市,大溪區,三元派出所,大溪區石園路53號,03-3801040
桃園市,大溪區,中新派出所,大溪區大鶯路1481號,03-3801853
桃園市,大溪區,慈湖分駐所,大溪區復興路一段1268號,03-3885891
桃園市,大溪區,百吉派出所,大溪區復興路二段209號,03-3885884
桃園市,復興區,三民派出所,復興區三民村11鄰水流東43號,03-3825605
桃園市,復興區,復興分駐所,復興區中正路2號,03-3822604
桃園市,復興區,溪內派出所,復興區羅浮村1鄰合流51-2號,03-3822958
桃園市,復興區,羅浮派出所,復興區羅浮村3鄰羅浮3號,03-3822606
桃園市,龜山區,大林派出所,龜山區中興路158號,03-3500070
桃園市,龜山區,坪頂派出所,龜山區大崗村大湖一路65號,03-3282570
桃園市,龜山區,大埔派出所,龜山區文德二路80號,03-3181519
桃園市,龜山區,大坑派出所,龜山區大坑路一段851號,03-3251310
桃園市,龍潭區,聖亭派出所,龍潭區淩雲村干城路21號,03-4891110
桃園市,龍潭區,石門派出所,龍潭區佳安村文化路230號,03-4712021
桃園市,龍潭區,高平派出所,龍潭區高平村中豐路高平段281號,03-4717204
桃園市,龍潭區,三和派出所,龍潭區三和村直坑24號,03-4794384
桃園市,蘆竹區,南崁派出所,蘆竹區南崁村南崁路179號,03-3223981
桃園市,蘆竹區,大竹派出所,蘆竹區大竹村大竹路540號,03-3232704
桃園市,蘆竹區,南竹派出所,蘆竹區南竹路二段97號,03-3121090
桃園市,蘆竹區,外社派出所,蘆竹區外社村山林路二段405號,03-3241749
新竹市,北區,第一分局,新竹市竹光路290號,03-5222725， 03-5224168#2704-05(勤務指揮中心24H)
新竹市,東區,第二分局,新竹市光復路二段798號,03-5728750#1， 03-5728748(勤務指揮中心24H)
新竹市,第三分局,第三分局,新竹市牛埔路432號,03-5380040， 03-5380055(勤務指揮中心24H)
新竹市,香山區,朝山派出所,新竹市中華路5段690號,03-5373165
新竹市,北區,南寮派出所,新竹市東大路3段541號,03-5224168#2328， 03-5362334
新竹市,北區,海瑞摃丸,新竹市北區西門街98號,03-5261115
新竹市,北區,淵明餅舖,新竹市北區中山路112號,0952-170115
新竹市,北區,新竹市十七公里海岸風景區旅遊服務中心,新竹市南寮街261號,03-5360350
新竹市,東區,池畔玻光,新竹市東大路一段2號,03-5622072
新竹縣,尖石鄉,尖石分駐所,新竹縣尖石鄉嘉樂村2鄰37號,03-5841144
新竹縣,尖石鄉,那羅派出所,新竹縣尖石鄉錦屏村8鄰24號,03-5841682
新竹縣,尖石鄉,玉峰派出所,新竹縣尖石鄉玉峰村5鄰45號,03-5847202
新竹縣,尖石鄉,宇老派出所,新竹縣尖石鄉玉峰村1鄰1號,03-5847238
新竹縣,橫山鄉,橫山派出所,新竹縣橫山鄉新興街103號,03-5931002
新竹縣,新埔鎮,新埔派出所,新竹縣新埔鎮中正路475號,03-5882034
新竹縣,橫山鄉,合興車站,新竹縣橫山鄉力行村中山街1段17號,03-6235065
新竹縣,橫山鄉,全家橫山致豐店,新竹縣橫山鄉大肚村12鄰中豐路二段112-2號,03-5931649
新竹縣,關西鎮,關西服務區,新竹縣關西鎮東安里上三屯14號,03-5876600
新竹縣,關西鎮,錦山派出所,新竹縣關西鎮錦山里2鄰錦山21號,03-5478174
苗栗縣,苗栗市,城市規劃館,苗栗縣苗栗市縣府路120號,037-369477
苗栗縣,苗栗市,新興旅社,苗栗縣苗栗市建國街3號,037-260133
苗栗縣,三義鄉,三義甘丹民宿,苗栗縣三義鄉雙湖村15鄰雙湖7-11號,0978-275231
苗栗縣,三義鄉,三義火車站,苗栗縣三義鄉雙湖村90號,037-874763
苗栗縣,三義鄉,世奇精緻餅店,苗栗縣三義鄉水美路156號,037-879988
苗栗縣,通霄鎮,台鹽通宵觀光園區,苗栗縣通霄鎮內島里122號,037-792121
苗栗縣,公館鄉,公館鄉農會,苗栗縣公館鄉館東村大同路266號,037-225211
苗栗縣,竹南鎮,龍鳳安檢所,苗栗縣竹南鎮龍鳳里海埔38-1號,037-482157
苗栗縣,竹南鎮,國泰玻璃觀光工廠,苗栗縣竹南鎮新南里24鄰崁頂151號2樓,037-614118
苗栗縣,卓蘭鎮,江記永安囍餅店,苗栗縣卓蘭鎮中山路13-14號,04-25892391
苗栗縣,南庄鄉,向天湖738文創餐坊,苗栗縣南庄鄉東河村16鄰向天湖25號,037-823922
苗栗縣,苗栗市,苗栗分局,苗栗市勝利里金鳳街109號,037-320059
苗栗縣,苗栗市,文山派出所,苗栗縣苗栗市至公路557號,037-337127
苗栗縣,苗栗市,北苗派出所,苗栗縣苗栗市清華里為公路227號,037-260344
苗栗縣,苗栗市,南苗派出所,苗栗縣苗栗市高苗里信義街60號,037-320367
苗栗縣,頭屋鄉,明德派出所,苗栗縣頭屋鄉明德村明德路131號,037-252538
苗栗縣,頭屋鄉,頭屋分駐所,苗栗縣頭屋鄉頭屋村中山街17號,037-253103
苗栗縣,三義鄉,鯉魚派出所,苗栗縣三義鄉鯉魚潭村3鄰54-1號,037-881040
苗栗縣,三義鄉,龍騰派出所,苗栗縣三義鄉西湖村伯公坑41-1號,037-872396
苗栗縣,三義鄉,三義分駐所,苗栗縣三義鄉廣盛村90號,037-872003
苗栗縣,公館鄉,福基派出所,苗栗縣公館鄉福基村5鄰133號,037-225984
苗栗縣,公館鄉,鶴岡派出所,苗栗縣公館鄉鶴山村11鄰232號,037-226975
苗栗縣,公館鄉,公館分駐所,苗栗縣公館鄉館中村大同路181號,037-225683
苗栗縣,銅鑼鄉,雞隆派出所,苗栗縣銅鑼鄉盛隆村35號,037-971012
苗栗縣,銅鑼鄉,雞隆派出所,苗栗縣銅鑼鄉銅鑼村中正路122號,037-981014
苗栗縣,竹南鎮,中港派出所,苗栗縣竹南鎮中港里中正路477號,037-470314
苗栗縣,竹南鎮,海口派出所,苗栗縣竹南鎮海口里6鄰62-12號,037-460684
苗栗縣,竹南鎮,竹南派出所,苗栗縣竹南鎮竹南里民族街72號,037-474796
苗栗縣,竹南鎮,大同派出所,苗栗縣竹南鎮大埔里公義路931號,037-581712
苗栗縣,後龍鎮,大山派出所,苗栗縣後龍鎮灣寶里5鄰93號,037-431764
苗栗縣,後龍鎮,外埔派出所,苗栗縣後龍鎮海埔里海埔5號,037-431361
苗栗縣,後龍鎮,聯港派出所,苗栗縣後龍鎮津龍里5鄰59號,037-450734
苗栗縣,後龍鎮,新港派出所,苗栗縣後龍鎮復興里6鄰建興路111號,037-722474
苗栗縣,後龍鎮,南勢派出所,苗栗縣後龍鎮南港里南勢山1鄰15-10號,037-921445
苗栗縣,後龍鎮,後龍分駐所,苗栗縣後龍鎮中龍里13鄰三民路107號,037-722520
苗栗縣,造橋鄉,談文派出所,苗栗縣造橋鄉談文村8鄰51-16號,037-622664
苗栗縣,造橋鄉,造橋分駐所,苗栗縣造橋鄉造橋村4鄰平仁路51號,037-624224
苗栗縣,卓蘭鎮,坪林派出所,苗栗縣卓蘭鎮坪林里5鄰50號,04-25921101
苗栗縣,泰安鄉,中興派出所,苗栗縣泰安鄉中興村長橋9號,037-992350
苗栗縣,頭份鎮,頭份派出所,苗栗縣頭份鎮中正路223號,037-663004
苗栗縣,三灣鄉,大河派出所,苗栗縣三灣鄉大河村6鄰河底48號,037-831081
苗栗縣,頭份鎮,斗坪派出所,苗栗縣頭份鎮斗坪里19鄰中正二路215號,037-665770
苗栗縣,頭份鎮,尖山派出所,苗栗縣頭份鎮廣興里2鄰中華路160號,037-622763
苗栗縣,三灣鄉,三灣分駐所,苗栗縣三灣鄉中正路256號,037-831071
苗栗縣,南庄鄉,蓬萊派出所,苗栗縣南庄鄉蓬萊村7鄰90號,037-822040
苗栗縣,南庄鄉,東河派出所,苗栗縣南庄鄉東河村5鄰50號,037-822094
苗栗縣,南庄鄉,田美派出所,苗栗縣南庄鄉獅山村4鄰106號,037-822134
苗栗縣,南庄鄉,陸家派出所,苗栗縣南庄鄉東河村24鄰鹿場2號,037-821570
苗栗縣,南庄鄉,南埔派出所,苗栗縣南庄鄉南富村13鄰大南埔14號,037-822752
苗栗縣,南庄鄉,南庄分駐所,苗栗縣南庄鄉東村大同路27號,037-822004
台中市,大里區,成功派出所,臺中市大里區成功路9號,04-24950763
台中市,豐原區,翁子派出所,臺中市豐原區豐勢路二段10號,04-25226021， 04-25275594
台中市,神岡區,神岡分駐所,臺中市神岡區神岡路121號,04-25622422
台中市,烏日區,烏日派出所,臺中市烏日區中山路2段309號1樓,04-23381402
台中市,烏日區,五光派出所,臺中市烏日區五光路281號,04-23381960
台中市,烏日區,溪南派出所,臺中市烏日區北里里溪南路二段638號,04-23351676
台中市,烏日區,溪尾駐在所,臺中市烏日區溪尾里溪岸路7號,049-2523603
台中市,大肚區,大肚分駐所,臺中市大肚區沙田路3段38號,04-26992167
台中市,大肚區,追分派出所,臺中市大肚區沙田路一段290號,04-26932108
台中市,大肚區,瑞井派出所,臺中市大肚區遊園路1之1號,04-26910205
台中市,龍井區,龍井分駐所,臺中市龍井區龍泉里沙田路4段245號,04-26353054
台中市,龍井區,龍津派出所,臺中市龍井區龍津里中央路1段165巷36號,04-26396084
台中市,龍井區,龍東派出所,臺中市龍井區茄投路67號,04-26397043
台中市,龍井區,麗水派出所,臺中市龍井區臨港東路2段317號,04-26395994
台中市,龍井區,犁份派出所,臺中市龍井區新庄里遊園南路194號,04-26312719
台中市,清水區,高美派出所,臺中市清水區護岸路29號,04-26113384
台中市,清水區,清水派出所,臺中市清水區鰲峰路23號,04-26222054
台中市,清水區,大秀派出所,臺中市清水區五權路438號,04-26265384
台中市,清水區,大楊派出所,臺中市清水區神清路45號,04-26200514
台中市,清水區,三田派出所,臺中市清水區中山路559號,04-26222146
台中市,沙鹿區,清泉派出所,臺中市沙鹿區中清路2-39號,04-26153884
台中市,沙鹿區,沙鹿分駐所,臺中市沙鹿區鎮政路12號,04-26625032
台中市,沙鹿區,明秀派出所,臺中市沙鹿區鎮南路一段450號,04-26314309
台中市,沙鹿區,光華派出所,臺中市沙鹿區光華路387號,04-26630624
台中市,梧棲區,梧棲分駐所,臺中市梧棲區中興路210號,04-26562860
台中市,梧棲區,安寧派出所,臺中市梧棲區中棲路二段18號,04-26560343
台中市,石岡區,石岡分駐所,臺中市石岡區豐勢路1021號,04-25722781
台中市,新社區,新社分駐所,臺中市新社區復盛里興社街二段28之3號,04-25811401
台中市,新社區,東興派出所,臺中市新社區東興里興社街一段285號,04-25811476
台中市,新社區,永源派出所,臺中市新社區永源里中和街一段20號,04-25811475
台中市,新社區,福中派出所,臺中市新社區福興里美林45號,04-25941364
台中市,新社區,交通東勢分隊,臺中市新社區中和街五段118巷48之1號,04-25823745
台中市,東勢區,東勢派出所,臺中市東勢區豐勢路512號1樓,04-25873802
台中市,東勢區,土牛派出所,臺中市東勢區和盛里豐勢路19號,04-25815600
台中市,東勢區,中坑派出所,臺中市東勢區隆興里5鄰東坑路665號,04-25874474
台中市,東勢區,茅埔派出所,臺中市東勢區慶東里東關路243號,04-25852472
台中市,東勢區,石城派出所,臺中市東勢區泰興里石城街297號,04-25874473
台中市,東勢區,大甲派出所,臺中市大甲區大甲里文武路1號,04-2687204
台中市,東勢區,日南派出所,臺中市大甲區孟春里中山路二段165號,04-26813700
台中市,東勢區,西岐派出所,臺中市大甲區西岐里順帆路94號,04-26811330
台中市,大安區,大安分駐所,臺中市大安區中庄里中山南路300號,04-26713320
台中市,大安區,海墘派出所,臺中市大安區海墘里大安港路1160號,04-26875845
台中市,外埔區,外埔分駐所,臺中市外埔區大同里六分路350號,04-26832690
台中市,外埔區,安定派出所,臺中市外埔區土城里土城路110號,04-26837725
台中市,后里區,后里分駐所,臺中市后里區墩西里公安路88號,04-25562037
台中市,后里區,義里派出所,臺中市后里區墩東里三豐路209號,04-25562333
台中市,后里區,泰安派出所,臺中市后里區泰安里安眉路１號,04-25562340
台中市,大甲區,大甲交通分隊,臺中市大甲區日南里工二路２號,04-26820785
台中市,和平區,和平派出所,臺中市和平區南勢里東關路三段270號。,04-25941324
台中市,和平區,天輪派出所,臺中市和平區天輪區東關路二段33號,04-25941193
台中市,和平區,谷關派出所,臺中市和平區博愛里東關路一段125號,04-25951114
台中市,和平區,德基派出所,臺中市和平區梨山里和平路二段16-1號,04-25980439
台中市,和平區,松茂派出所,臺中市和平區梨山里中興路4段54號,04-25989692
台中市,和平區,環山派出所,臺中市和平區平等里中興路3段48號,04-25982242
台中市,和平區,梨山派出所,臺中市和平區梨山里中正路103號,04-25989580
台中市,和平區,志良派出所,臺中市和平區平等里平等村中興路2段47號,04-25901040
台中市,和平區,勝光派出所,臺中市和平區平等里中興路1段21號,04-25901004
台中市,和平區,雙崎派出所,臺中市和平區達觀里東崎路2段39號,04-25911214
台中市,和平區,竹林派出所,臺中市和平區達觀里東崎路1段89號,04-25911114
台中市,和平區,大棟派出所,臺中市和平區中坑里雪山路2號,04-25971106
台中市,和平區,雪山派出所,臺中市和平區中坑里雪山路10號,04-25883514
台中市,和平區,桃山派出所,臺中市和平區達觀里東崎路一段 桃山巷7-2號,04-25911314
台中市,芬園鄉,就是愛荔枝樂園,彰化縣芬園鄉中山路167號,04-8590909
台中市,彰化市,旅。咖啡,彰化縣彰化市民權路241號,04-7282972
台中市,員林鎮,晨陽文旅,彰化縣員林市中山路一段382巷3號,04-8396655
台中市,田中鎮,全家田中金斗店,彰化縣田中鎮斗中路一段232號,04-8748349
台中市,西區,美術園道商店街管理委員會,臺中市西區五權西二街152號,04-23755482
台中市,清水區,清水服務區,臺中市清水區吳厝二街89號,04-26201378
台中市,清水區,梧棲漁港安檢所,臺中市清水區海濱里北堤路21號,04-26565524
台中市,新社區,新峰農場,臺中市新社區大南里中和街二段264號,04-25811938
台中市,外埔區,裕珍馨食品股份有限公司,臺中市外埔區甲后路633號,04-26831969
台中市,后里區,中社觀光花市,臺中市后里區三豐路469-13號,04-25576926
台中市,大甲區,大甲火車站,臺中市大甲區中山路一段828號,04-26872022
台中市,霧峰區,霧峰林家宮保第園區,臺中市霧峰區民生路26號,04-23317985
台中市,潭子區,寶熊漁樂館,臺中市潭子區中山路三段11號,04-35013338
台中市,潭子區,全家潭子新圓通店,臺中市潭子區勝利路58號,04-25343731
彰化縣,花壇鄉,花壇分駐所,彰化縣花壇鄉中正路1號,04-7862014
彰化縣,花壇鄉,三家派出所,彰化縣花壇鄉三春村彰員路109號,04-7862454
彰化縣,芬園鄉,芬園分駐所,彰化縣芬園鄉彰南路四段175號,049-2522419
彰化縣,芬園鄉,縣庄派出所,彰化縣芬園鄉彰南路二段131號,049-2525151
彰化縣,芬園鄉,安山派出所,彰化縣芬園鄉大彰路三段147巷63號,04-8590056
彰化縣,彰化市,中正路派出所,彰化市西勢街150號,04-7242544
彰化縣,彰化市,中華路派出所,彰化市中華路193號,04-7223507
彰化縣,彰化市,民生路派出所,彰化市民生路322號,04-7228644
彰化縣,彰化市,八卦山派出所,彰化市中山路二段456號,04-7284292
彰化縣,彰化市,民族路派出所,彰化市南瑤路257號,04-7228433
彰化縣,彰化市,莿桐派出所,彰化市彰鹿路6號,04-7523151
彰化縣,彰化市,泰和派出所,彰化市泰和路二段399號,04-7237560
彰化縣,彰化市,大竹派出所,彰化市彰南路二段160號,04-7381107
彰化縣,彰化市,快官派出所,彰化市彰南路五段26號,04-7381006
彰化縣,彰化市,彰化分局,彰化市民生路234號,04-7222439
彰化縣,田尾鄉,田尾分駐所,彰化縣田尾鄉光復路三段138號,04-8832854
彰化縣,田尾鄉,海豐派出所,彰化縣田尾鄉民生路三段280號,04-8222160
彰化縣,埤頭鄉,埤頭分駐所,彰化縣埤頭鄉斗苑西路305號,04-8922041
彰化縣,埤頭鄉,中和派出所,彰化縣埤頭鄉溪林路337號,04-8896155
彰化縣,溪州鄉,溪州分駐所,彰化縣溪州鄉中山路三段292號,04-8895029
彰化縣,溪州鄉,三條派出所,彰化縣溪州鄉南九甲巷5號,04-8895432
彰化縣,溪州鄉,成功派出所,彰化縣溪州鄉庄中路20號,04-8802163
彰化縣,北斗鎮,北斗派出所,彰化縣北斗鎮新政里光復路215號,04-8882604
彰化縣,田中鎮,田中派出所,彰化縣田中鎮西路里斗中路6號,04-8742051
彰化縣,田中鎮,內安派出所,彰化縣田中鎮碧峰里中南路二段601號,04-8742008
彰化縣,田中鎮,田中分局,彰化縣田中鎮沙崙里興酪路一段299號,04-8756910
彰化縣,社頭鄉,社頭分駐所,彰化縣社頭鄉社頭村員集路二段210號,04-8732036
彰化縣,社頭鄉,朝興派出所,彰化縣社頭鄉朝興村水源路12號,04-832174
